RegistrationNo,CompanyName,BuildingNumber,StreetName,TownName,CountrySubDivision,PostCode,Country
335800WVWM5F7MGBB234,AKRIVIA DIGITAL SOLUTIONS PRIVATE LIMITED,"10, 5, 2, 1","nan, DOOR NO.10-5-2/1, RAGHU BUILDING, RAMNAGAR",VISAKHAPATNAM,IN-AP,530002,IN
9845006F5PA2E9C77T77,SRI DVS RICE INDUSTRIES,"301A, 21ST","nan, DOOR NO. WARD, ADONI ROAD, SIRUGUPPA",Ballari,IN-KA,583121,IN
335800PO5TQZMCNJJB09,SURAKSHA HOSPITALS,"5, 2, 60, 27, 3, 27, 1","Pedestrian Overpass, DOOR NO.5-2-60, SURVEY NO. 27-3, 27-1, SRIKAKULAM ROAD, SRI CHAITANYA COLLGE, RAJAM",VIZIANAGARAM,IN-AP,532127,IN
335800Y27HXNCPCQHD43,TOP LIGHT FABRICS PRIVATE LIMITED,7B,"nan, DOOR NO., TOP LIGHT BUILDING, PALLADAM ROAD, COIMBATORE",TIRUPUR,IN-TN,641604,IN
335800SG54ARLLFUDG85,MAHESHWARI SALT TRADING COMPANY,"3, 29, C65, C66","nan, DOOR NO: 3/29, PLOT NO: C65 & C66, SIPCOT INDUSTRIAL COMPLEX",TUTICORIN,IN-TN,628008,IN
9845008R9C1B00FC4441,QBURST SOFTWARE SERVICES PRIVATE LIMITED,4th,"nan, DPI, Vazhuthacaud,  Floor, Artech Magnet, Thycaud",Thiruvananthapuram,IN-KL,695014,IN
9845009DE4788F365C88,GUARDIAN CABLES AND CONDUCTORS PRIVATE LIMITED,"408, 409","nan, DSIDC Industrial Area, Narela, C-408-409, DSIDC INDUSTRIAL COMPLEX NARELA",Delhi,IN-DL,110040,IN
8945006MI1WFVFO41I61,SURYA PLASTICS,702,"nan, DSIDC Industrial Area, Narela, E-, DSIIDC, INDUSTRIAL AREA",NEW DELHI,,110040,IN
6488CZM9LF853O5X4859,ACME SAFE INDIA PRIVATE LIMITED,"Sector 1, 1047","nan, DSIIDC Industrial Area, Sector 1, Bawana, G-1047, IIND FLOOR DSIIDC INDL. AREA, NARELA",DELHI,,110040,IN
6488N1E8ED821MB5S249,COMTECH DIGITRONICS PRIVATE LIMITED,"Sector 1, 106, 5","nan, DSIIDC Industrial Area, Sector 1, Bawana, Plot No. 106, Ground Floor, Pkt-A, Sec-5, DSIDC",Delhi,,110039,IN
89450080DZT6PEL01I14,BAJAJ BABY PRODUCTS PRIVATE LIMITED,"Sector 1, 11, 1","nan, DSIIDC Industrial Area, Sector 1, Bawana, Plot No. 11, Sector-1 DSIISC Bawana Industrial Area",Delhi,,110039,IN
984500D801N7DT1E4H48,PITAMBARA BUILDSQUARE PRIVATE LIMITED,"2, 3","nan, Dadabari, 2-KA-3, ADARSH NAGAR DADABARI",KOTA,IN-RJ,324009,IN
3358004OAHYP133Q1E63,KHODAL KIDS STUDIO,"5TH, 526","nan, Dadar West, 5TH FLOOR, 526, ATLANTIC PLAZA, KAKASAHEB GADGIL MARG, GARRAGE GULLY TILAK, DADAR-WEST",MUMBAI,IN-MH,400028,IN
335800YGRRAHYN1S5V20,SPARK DEVELOPERS PRIVATE LIMITED,"A UNIT 601, 6TH, PLOT FP 616","Senapati Bapat Marg, Dadar West, A UNIT 601, 6TH FLOOR, PLOT FP 616 (PT), NAMAN MIDTOWN, S B",MUMBAI,IN-MH,400028,IN
3358005T9VCA6BBOE460,KRVP REALTORS PRIVATE LIMITED,"A UNIT 601, 6TH, PLOT FP 616","Senapati Bapat Marg, Dadar West, A UNIT 601, 6TH FLOOR, PLOT FP 616 (PT), NAMAN MIDTOWN, S B",DADAR WEST,IN-MH,400028,IN
335800QWJ6ACW2KMM207,ROST CONSULTANCY PRIVATE LIMITED,"FLAT5B, 967","Shankar Ghanekar Road, Dadar West, Prabhadevi, SIDDHI APARTMENTS, , S G MARG",MUMBAI,IN-MH,400028,IN
6488OB11910F8U8SGN93,GREENGROVE SOLUTION LLP,2,"Vaishnodevi Road, Dahin Nagar, F-, Green Aristo Plaza, Opp., Canal, Jahangirabad, Rander, Gujarat, India",Surat,,395005,IN
8945003NSQDEHBZRLI19,M. V. GOLD PRIVATE LIMITED,"41, 5th","nan, Dahisar East, C/ Floor, Beliram Ind Est, Dahisar(East)",Mumbai,,400068,IN
335800NUYL89B97BKF74,VIBRANT INFRASTRUCTURES,R NO 8,"Bharucha Road, Dahisar East, , AISHABAI DAWOOD CHAWL, NR POORNA PRAJNA SCHOOL",MUMBAI,IN-MH,400068,IN
8945009TD5J63JU25Y67,AMAN CLEANING EQUIPMENTS PRIVATE LIMITED,"6, 11, 3RD","nan, Dallupura, C - 6, PROP. NO. 11, 3RD FLOOR, DURGA PARK",Delhi,,110096,IN
89450073A8R4GEMYD209,MOLECULES ANALYTICAL LAB SOLUTIONS PRIVATE LIMITED,"VSS NANDADEEP 705, 02, 057, 705","Medchal Road, Dandamudi Enclave, Jeedimetla, VSS NANDADEEP 705 D.No.02-057/A/705 Quthbullapur NA HYDERABAD Rangareddi",Hyderabad,,500055,IN
98450095FBE0A3D37D19,JAIPRAKASH HOSPITAL AND RESEARCH CENTRE PRIVATE LIMITED,"2013, 2349","nan, Dandiapali, PLOT NO. 2013/2349, DAYANAND NAGAR, DANDIAPALI ROAD, BRAHMANI TARANG, SUNDARGARH",ROURKELA,IN-OD,769004,IN
98450064E0Y40V4C9C11,DIVINE INFRACON,"2ND, 202, 83, 1, 2","nan, Dangat Patil Nagar, Shivane, 2ND FLOOR, FLAT NO. C-202, SR.NO. 83/1/2, Rajas Residency, NEAR NDA ROAD",Pune,IN-MH,411023,IN
254900Y8VA8I0NNYY443,SIDDHACHAL FAB PRIVATE LIMITED,"1, 1, 2, 3","nan, Dapode, BUILDING E-1, GALA-1, 2, 3, JAI SHREE RAM COMPLEX, DAPODA ROAD, VILLAGE VAL, TALUKA- BHIWANDI",THANE,IN-MH,421302,IN
8945007HWTX23MZHIU57,NINGYUAN MACHINE TOOL PRIVATE LIMITED,"188, 7","Dapuda Road, Dapode, Building No.188/7, Indian Corporation, Dapoda, Mankoli Naka",Bhiwandi,,421302,IN
335800B28YA86459QM38,RISING INDIA,"1, 16","Mumbai - Nashik Expressway, Dapode, GODOWN NO. F-1/16, SAGAR COMPLEX, HIGHWAY, VILLAGE:OVALI, THANE",BHIWANDI,IN-MH,421302,IN
98450013FA43D3CED724,SHOBHNATH PAPERS LLP,"1435, 6","nan, Dapode, H.NO. 1435/6, DAPODE ROAD, VAL VILLAGE, BHIWANDI",THANE,IN-MH,421302,IN
89450083MECB40IGS696,BHUVIS LAXMI PROPERTIES (INDIA) PRIVATE LIMITED,"304, 2, 117, 304","nan, Darga Hussainshahwal, AT NO.304, A BLOCK, H.NO.2-117/WP/304, HS DARGA SHAVALI, SHERLINGAMAPALLY (M), Dargah Hussain Shahwali",HYDRABAD,,500008,IN
25490042G3F5QEKNM955,SRVN MARINE METCORP LLP,"131 GR FL PLOT 131, STREET 3","nan, Darukhana, Byculla, 131 GR FL PLOT 131 BPT PLOT OFF MAGAZINE, STREET 3RD X LANE DARUKHANA, MAZGAON",MUMBAI,IN-MH,400010,IN
98450078DGE40BE08571,OVERSEAS TIMBER CORPORATION,"77, 4","77, Lakdi Bunder Road, Darukhana, Byculla, GROUND FLOOR, PLOT NO.77/4, REAY",Mumbai,IN-MH,400010,IN
335800PSUBY1EPC9HI49,MAHAVIR GHEE BHANDAR,28,"Netaji Subhash Marg, Daryaganj, , ADVANI MARKET, OUTSIDE DELHI GATE",AHMEDABAD,IN-GJ,380004,IN
8945007XGODLKRBALY21,SPIKE ADVERTISING PRIVATE LIMITED,"4, 24A","nan, Daryaganj, 4/24A, AB HOUSE, FIRST FLOOR, ASAF ALI ROAD, DARYA GANJ",NEW DELHI,,110002,IN
8945008B0GP5R4CO6U69,ROPAR PROPERTIES AND BUILDERS PRIVATE LIMITED,"SCO 12, 16","4, Street Number 8, Dashmesh Nagar, SCO 12-16, SUN ENCLAVE, Rupnagar",Ropar,,140001,IN
8945008HSCUXUAVCZA72,GOODS CARRIER OF INDIA,"Sector 23, Plot No 128","nan, Datta Nagar, Transport Nagar, Nigdi",PUNE,,411044,IN
8945009YWPAT2VPPPY78,Somwarpet Seetharam Anil,"Dattagalli 3, 946 dattagalli 3","nan, Dattagalli 3rd Stage, no.946 dattagalli 3rd stage, mysuru",mysuru,,570023,IN
984500F64D69391C5B47,CRYSTAL INFRA,"2, 10, 593","Ambernath - Badlapur Road, Dattanagar, Room No. 2, New House, Ground, House No. 10-593, Chikhaloli Gaon, Ambarnath, Thane",Thane,IN-MH,421503,IN
89450095YM2H2DOEPI05,CORPSHIELD CONSULTANCY SERVICES PRIVATE LIMITED,"1st, 893","nan, Dattawadi, 1st Floor, House No. 893, Near Javadekar Bakery and Mhasoba Chowk",Pune,,411030,IN
335800T2QYQ1UHH4OS35,CELLO ELECTRICALS PRIVATE LIMITED,45,"nan, Dayanand Nagar, Pocket D, Nehru Nagar III, Nehru Nagar, II-F- NEHRU NAGAR, GHAZIABAD",GHAZIABAD,IN-UP,201001,IN
89450088E8D3WFQQ2E27,YASHASWI ACADEMY FOR SKILLS,"72, 1, 15","72, Lane Number 15, Deccan Gymkhana, C T S NO.72/1 No.15 Prabhat Road, Pune",PUNE,,411004,IN
335800MYIELSG18JW203,UMESHAM EDUCATION SOCIETY,82,"nan, Deen Dayal Nagar,  DEEN DAYAL NAGAR",KANPUR,IN-UP,208002,IN
64885SM2J6D4ZY55I536,VISHAL METAL CASTING PRIVATE LIMITED,411,"nan, Deepali, Pitampura, , DEEPALI PITAMPURA, Delhi",NEW DELHI,,110034,IN
894500ABUBFAPBFKOM14,SAMARTHAN SYSTEMS PRIVATE LIMITED,SNO 172P PIMSAUDAGAR BLDG FL1003,"Vasant Avenue, Deepmala Society, Pimple Saudagar,  PUNE",Pune,,411027,IN
6488XHE48YZ865R8U745,UTTARANCHAL FORGINGS INDUSTRY,2,"nan, Defence Colony,  freinds enclave, Shah Nagar, Post Office Defence Colony, Uttarakhand",Dehradun,,248001,IN
25490041QSBE3EC78533,ION TRADING INDIA PRIVATE LIMITED,136,"nan, Defence Colony, A- Defence Colony",New Delhi,IN-DL,110024,IN
335800E3PQCZF6BX8D25,KWC HOMES LLP,31,"nan, Defence Colony, D-, SECOND FLOOR, SOUTH DELHI",NEW DELHI,IN-DL,110024,IN
8945008PHIBBRDDBP255,DINESH KUMAR JAIN HUF,423,"nan, Defence Colony, D- Defence Colony",Delhi,,110024,IN
335800WLQ9XHGENYMN78,GLOBAL FERTILITY SOLUTIONS PRIVATE LIMITED,"14, 1ST","nan, Defence Colony, E- FLOOR, SOUTH DELHI",NEW DELHI,IN-DL,110024,IN
8945009T7LZEGKI6IE90,SD ENTERPRISE,PLOT NO 10,"2, Amin Marg, Dena Bank Society, Madhur Nagar,  A, ASHIRWAD, VIDHYAKUNJ SOCIETY, STREET NO",RAJKOT,,360005,IN
984500PD2F70B8676E15,INDEEYA INFRASTRUCTURE PRIVATE LIMITED,48,"Navarang Colony Road, Deopur, PLOT NO. , NEHRU HOUSING SOCEITY DEOPUR",Dhule,IN-MH,424005,IN
984500EB0E990UAEA138,PURVAJA EDUCATIONAL FOUNDATION,30,"Vidyapith Road, Deshbandhu Para, , DESHBANDHU",SILIGURI,IN-WB,734004,IN
9845007C8G2F57BJ2F87,ASHODAYA CEMENT PRODUCTS,60,"nan, Devanahalli, SY No. , Sonnenahalli Village, Kunda Hobli",Bengaluru,IN-KA,562110,IN
335800VMZ18R78DQ9I84,SARTHAK INNOVATIONS PRIVATE LIMITED,"173, 20","nan, Dewas Naka, Lasudia Mori, KHASRA NO.173/20, TALAWALI CHANDA, NEAR LAURELS SCHOOL INTERNATIONAL, DEWASNAKA",INDORE,IN-MP,452010,IN
335800BIGTTZW3K7BH94,SAKTHI CABLES,1,"Kundrathur Main Road, Dhanlakshmi Nagar, NO., MULTI INDUSTRIAL AREA, KERUKAMPAKKAM",KANCHEEPURAM,IN-TN,600122,IN
98450074A6575A668537,NAGPUR NEURO SCIENCES CLINICS PRIVATE LIMITED,"32, 32, 411","nan, Dhantoli, PLOT NO. 32/B & 32/C, C.S. NO. 411, NEAR DHANTOLI",NAGPUR,IN-MH,440012,IN
335800AO1NYQCPH4HB47,KANKARIYA SERVICE STATION,"46, 4","nan, Dhanvantari Colony, Wadgaon Sheri, SR. NO. 46/4, PUNE NAGAR ROAD",PUNE,IN-MH,411014,IN
984500E9DCFEE8G4BE73,ARIHANT DEVELOPERS,"221P, 138 TO 157","nan, Dharam Nagar, RAIYA REVENUE SERVY NO. 221P, PLOT NO. 138 TO 157/A, SHANTINAGAR MAIN ROAD, OPP. WATER TANK, JALARAM CHOWK, Raiya Dhar",RAJKOT,IN-GJ,360005,IN
9845000C1TF4BD43F673,PRAFULVED INFRA PRIVATE LIMITED,501,"nan, Dharampeth, F NO. , SHRIKRSHNA RESIDENCY DHARAMPETH",Nagpur,IN-MH,440010,IN
335800AHRQK8GYV6CB73,HARSH REALTY BUILDERS & DEVELOPERS,1,"Sant Rohidas Marg, Dharavi, GROUND FLOOR, C-, C WING, PRIYA DARSHANI COOPERATIVE HOUSING SOCIETY, MUKUND NAG, MUKUND NAGAR",MUMBAI,IN-MH,400017,IN
984500H8FE6JEBBF3E64,"K.K.POLYMERS PVT LTD,","281, 2A, 1ST","nan, Dharma Reddy Colony Phase II, Kukatpally Housing Board Colony, Kukatpally, PLOT NO. 281/2A, 1ST FLOOR, VASANTH NAGAR, PHASE VI, K.P.H.B COLONY",Hyderabad,IN-TS,500072,IN
984500E9C6DB9UAA9B20,Yashaswini Vikas Pratishthan,"45, 7","nan, Dhayari, SR No. 45 B/7, Manali Apartments, Gaarmaal",Pune,IN-MH,411041,IN
98450053DFEA594C4F84,VITRAG SEVENTEEN FAMILY TRUST,"25, Amba Township Sector 1","Dada Bhagwan Ring Road, Dhiren Sanghvi A - 25 Sahaj, Amba Township Sector 1, B/H Simandhar City, near Trimandir Adalaj",Gandhinagar,IN-GJ,382421,IN
984500UF64F11NBCD073,EXAGRES WAREHOUSING LLP,"10, 2","nan, Dhrab, ROOM NO. 10, MARUTI CORNER, PLOT NO. 2, KACHCHH",Mundra,IN-GJ,370421,IN
335800NPDP1ZPCPRE955,GALAXY LOGISTIC,PLOT NO 128,"nan, Dhrub, , GIDC DHRUB, MUNDRA",MUNDRA,IN-GJ,370421,IN
8945004UWS4D84DYT210,Shree Govind International,"163, RAGUVEER INDUSTRIAL ESTATE 2, BEHIND PLATINUM INDUSTRIAL PARK 1","nan, Dibiyapur, Vatva, , OPP. VATVA RAILWAY STATION",Ahmedabad,,382445,IN
9845008A7072E9B1CF95,NEW DHILLON STAR CARRIERS PRIVATE LIMITED,"487, 9","nan, Dilshad Garden, 487/9, FIRST FLOOR, DARPAN COMPLEX, MAIN GT ROAD",Delhi,IN-DL,110095,IN
9845004F5FT708D87054,KRSZ PROPERTY SOLUTIONS PRIVATE LIMITED,2206,"nan, Dina Bama Estate, Bhandup West, Flat No. , Stellar Wing-A, Mahavir Universe LBS Road, Bhandup",Mumbai,IN-MH,400078,IN
89450069KFRY8ZY92U85,AHANA GYNAECARE PRIVATE LIMITED,119,"nan, District Center, Chandrasekharpur, PLOT NO-, DISTRICT CENTER CHANDRASEKHARPUR",BHUBANESWAR,,751016,IN
9845001DA4671B9FFF54,AEROGEN MEDICAL DEVICES INDIA PRIVATE LIMITED,"131, 1, 4","M-1, Mandir Marg, District Centre, Block M, Saket, 131 Rectangle-1, D-4",New Delhi,IN-DL,110017,IN
335800Z7QJYTN5M1T198,RADIANCE SUNSHINE POWER PRIVATE LIMITED,"LEVAL 4, RECTANGLE 1, 4","M-1, Mandir Marg, District Centre, Block M, Saket, LEVAL 4, RECTANGLE 1, COMMERCIAL, COMPLEX, D-4, SAKET (SOUTH DELHI), SOUTH DELHI, NEW DELHI, DELHI, INDIA",DELHI,IN-DL,110017,IN
894500870CF75LRT6E59,J.D. HOISTS AND CRANES PRIVATE LIMITED,"409, 2 DDA BUILDING 2","Professor Joginder Singh Marg, District Centre, Janakpuri, 409/2 DDA BUILDING 2DISTT CENTRE JANAKPURI",NEW DELHI,,110058,IN
335800PZH4H518DE1F14,SHANI RAJ ENTERPRISES PRIVATE LIMITED,"OFFICE NO 919, 9TH, PLOT NO 11","nan, District Centre, Janakpuri, OFFICE NO 919, 9TH FLOOR, PLOT NO 11, KIRTI SHIKHAR DISTRICT CENTRE JANAKPURI, NEW DELHI, DELHI, DELH",DELHI,IN-DL,110058,IN
648896O7MZ41ZFL3D493,TEQ GREEN POWER XXII PRIVATE LIMITED,"Sector 6, 208, 2nd","Court Chowk Road, District Centre, Sector 6, Pushp Vihar, 208, Square One Mall, 2nd Floor District Centre, Saket, Delhi",New Delhi,,110017,IN
6488BZ2N2097XMM2B054,TEQ GREEN POWER XXIII PRIVATE LIMITED,"Sector 6, 208, 2nd","Court Chowk Road, District Centre, Sector 6, Pushp Vihar, 208, Square One Mall, 2nd Floor District Centre, Saket, Delhi",New Delhi,,110017,IN
984500AFC1F37C5EFV60,VESTA HOLDINGS PRIVATE LIMITED,"Sector 6, 3","nan, District Centre, Sector 6, Pushp Vihar, PLOT NO - A - 3 MULTIPLEX BLOCK, SAKET",South Delhi,IN-DL,110017,IN
9845009P7D98ACFF6357,MARS DWELLERS PRIVATE LIMITED,"43, 1","43, Rajpur Road, Dobhalwala, Chukkuwala, 43/1",DELHI,IN-DL,110054,IN
984500ABTM840692CA75,PUSHKALAM DEVELOPERS,"4TH, 407, 1ST","nan, Doddakallasandra, Konanakunte, 4TH FLOOR, NO. 407, PYRAMID PLATINA, NARAYANA NAGAR, 1ST STAGE",BENGALURU,IN-KA,560062,IN
8945001Y7IQB4S01VA38,CASTECH FOUNDRIES PVT LTD,"1708, 1709","nan, Dolatpara, 1708-1709, GIDC PHASE- II",Junagadh,,362003,IN
6488OE395WKJ60I6W276,DMR INFRA,"1, 2, 441, 442, 443","nan, Domalguda, Himayatnagar, 1-2-441, 442&443, DOMALAGUDA, Telangana",Hyderabad,,500029,IN
984500ADED01A7BC4D82,CKV TEXTILE PRIVATE LIMITED,"5th, 502","Patharli Road, Dombivli East, 5th Floor, 502, Sarvoday Height, Near Shiv Mandir, Kalyan, Dombivali, Kalyan",Thane,IN-MH,421201,IN
335800C2J4ZOHAYKND87,BINAYAK CHEMICALS PRIVATE LIMITED,26,"nan, Dombivli East, PLOT NO. C-, MIDCINDUSTRIAL AREA, DOMBIVALI EAST, THANE, KALYAN",DOMBIVALI,IN-MH,421203,IN
984500M414C42DCB7A24,S. I. SURGICAL PRIVATE LIMITED,"47, 48","nan, Domjur, 47/48 VILL: NORTH NIBRA, P.O: NIBRA, P.S : DOMJUR",Howrah,IN-WB,711409,IN
335800D5SH6HGFUZY771,CODING CHEF PRIVATE LIMITED,"1st, NO 14, 4TH","nan, Domlur I Stage, 1st Stage, Domlur, MNR PRIDE, NO 14, 4TH FLOOR, DOMLUR SERVICE ROAD, OLD AIRPORT ROAD, DOMLUR LAYOUT",BANGALORE,IN-KA,560071,IN
6488PPS4UQ26F34K5096,DEBIJHORA TEA CO LTD,"3rd, Mittal Bus Stand 2","Sevoke Road, Don Bosco Colony, Galaxy Tower, 3rd Floor, NR-P.C. Mittal Bus Stand 2nd Mile, Jalpaiguri, West Bengal",Siliguri,,734001,IN
335800CCXDQM2AET5686,RAJLAXMI REDEVELOPERS,"1, KALA KUTIR BLDG 1","nan, Dongarpada, Y K Nagar, Virar West, FIRST, OFFICE NO., B/H DONGAR PADA, VASAI VIRAR, PALGHAR",PALGHAR,IN-MH,401303,IN
984500LD838BD0A0A531,SUPREME FEEDS (INDIA) PRIVATE LIMITED,"2, 298, 2","National Highway 66, Door No. 2-298/2, N.H. Heroor",Udupi,IN-KA,576213,IN
984500GD2E9740D7F098,NIZAM AGRO INDUSTRIES,"188, 188, 175, OFFICE PREMISES 2, 1, 232","Barkatpura Street, Dubbawada, INDUSTRIES ADDRESS, SY NO. 188/AA, SY NO.188/A, SY NO. 175/EE, OFFICE PREMISES 2-1-232, BARKATH PURA, PEDDAPUR, METAPALLY",Jagtial,IN-TS,505325,IN
3358009TQSMDBUR3LF16,SANITECH PROJECTS AND CONSULTANCY,105,"Kalindi Midtown Road, Dudhia, , RITURAJ BUSINESS CENTER, A.B. BYPASS, BICHOLI MARDANA",INDORE,IN-MP,452016,IN
8945009RIMXYFRVIBA95,SNEHAA ORGANICS PRIVATE LIMITED,"PLOT NO 290, 291","nan, Dulapally, PLOT NO 290 & 291, ADJACENT TO IDA",HYDERABAD,,500055,IN
98450057BD5BDI4C5721,MEGASTAR HOSPITALS AND MEDICAL SCIENCES PRIVATE LIMITED,"1, B 27, 70","nan, Durgakund, Jawahar Nagar Colony, Bhelupur, Flat No. 1, B 27/70, Barhar Kothi",Varanasi,IN-UP,221010,IN
335800L9ZSWYHP7LH540,MAHADEV METALIKS PRIVATE LIMITED,402,"Lane, Dwarakapuri, Punjagutta, , MARUTHI GRANDEUR APARTMENTS, DWARKAPURI COLONY",HYDERABAD,IN-TS,500082,IN
6488PP3I5PFXF6719898,UNITY INFRA,E 24,"New Sama Road, VALMIKINAGAR SOCIETY, Nr. Old Ramji Mandir, Gujarat",Vadodara,,390024,IN
984500A8B9F597AMF139,AKSHAR INFRA,"1, 102, 29, 31, 36, 37","salvav road, E-1, 102, Gunjan, SURVEY NO. 29/31/36/37, CHHARWADA, VAPI",Valsad,IN-GJ,396191,IN
894500BE6J5GNOLILY94,CHANDRA ENGINEERS,131,"nan, E-, CHANDRA ENGINEERS, EPIP, RIICO INDL ALWAR RAJASTHAN, ALWAR, ALWAR, RAJASTHAN",ALWAR,,301706,IN
6488B0PPK87VOQ621959,SARVESHWAR UDHYOG,"155A, 156, 3RD","nan, E-155A-156, EXTENTION, 3RD PHASE, INDUSTRIAL AREA, BALOTRA, Rajasthan",Barmer,,344022,IN
6488C2F2H2EWOS170022,CHITLANGIA INDUSTRIES,"18, NH 48","nan, E-18, Chitlangia Industries, NH 48, RIICO Industrial Area Srinagar",Ajmer,,305025,IN
335800HEW2URKSEZOI04,SRI LAKSHMI GANAPATHI TRADING COMPANY,"18, 18","nan, E-18, INDUSTRIAL PARK, E-18, INDUSTRIAL PARK",NALGONDA,IN-TS,508207,IN
89450086334LBPSJ9212,KASA TECHNOLOGIES LIMITED,190,"nan, E- IST FLOORGREATER KAILASH PART - I",NEW DELHI,,110048,IN
9845006142B2EOCL0D08,JINKRUPA INDUSTRIES LLP,"25, 3rd, 1","nan, E-25, 3rd Floor, Sumel Business Park -1, N C Market",Ahmedabad,IN-MH,380002,IN
8945007EOFDXP120S678,A.P. Rubber Industries,29,"nan, E-, INDUSTRIAL AREA BHADRABAD",Haridwar,,249402,IN
9845009F2AY94001D731,SHREE BALAJI INDUSTRIES,33,"nan, E-, INDUSTRIAL AREA, MERTA CITY",NAGAUR,IN-RJ,341510,IN
33580087CEDDUV3XXE12,REBY CASTINGS PVT LTD,360,"nan, E-, INDUSTRIAL AREA",BHIWADI,IN-RJ,301019,IN
335800T1VQUM834DG516,SWADESH AGROTECH PRIVATE LIMITED,"5, 17","nan, E-5, Arera Colony, C-17, PARIJAT COMPLEX, BHOPAL",BHOPAL,IN-MP,462016,IN
3358002BHHZJRC6BHQ03,RITE SOFTWARE INDIA PRIVATE LIMITED,"EAST HALF OF 3, ACE TECH PARKSY NO 96","nan, EAST HALF OF 3RD FLOOR, ACE TECH PARKSY NO 96, WING-B, NANAKRAMGUDA VILLAGE, K.V.RANGAREDDY, SERI LINGAMPALLY",HYDERABAD,IN-TS,500032,IN
9845008BEE38Y61E6467,LAKHDATAAR ASSOCIATES INDIA LLP,"ARCH SQUARE X2, 601, Y1","nan, EP Block, Sector V, Bidhannagar, ARCH SQUARE X2, ROOM NO. 601, EP-Y1, SALT LAKE CITY, Sech Bhawan",North 24 Parganas,IN-WB,700091,IN
213800F8N8WMHVXZ5H61,METSO OUTOTEC METALS INDIA PRIVATE LIMITED,NORTH 24,"nan, EP Block, Sector V, Bidhannagar, SOUTH CITY PINNACLE, SECH BHAWAN, SALTLAKE,  PARGANAS",KOLKATA,IN-WB,700091,IN
335800QKIAZDIEKCB812,VOLKER MOTORS,26,"Thalassery road, EP VI--H, SUPREME BUILDING, THALASSERI, NADAL, EDAKKAD, KANNUR, KERALA, EDAKKAD",KANNUR,IN-KL,670663,IN
8945007B4XRA0GGSQE75,ENVISION NETWORK TECHNOLOGIES PRIVATE LIMITED,"119, EPIP INDUSTRIAL AREA 1, 3","nan, EPIP Zone, Brookefield, # 119, EPIP INDUSTRIAL AREA 1ST PHASE ROAD NO. 3, WHITEFIELD",Bangalore,,560066,IN
984500CA0D712F5QA378,RAJASHEKAR CHOWDAPPA REDDY (HUF),"1, 6, 24","nan, EPIP Zone, Brookefield, PHASE- 1, SY NO. 6, 24, KALYANI PLATINA TECH PARK, KUNDALAHALLI",BANGALORE,IN-KA,560037,IN
8945003JY5N7ISQS8M18,SOUTH EAST ASIAN EDUCATION TRUST,4Th,"nan, Eakatha Nagar,  Cross",Mniwara Layout,,560049,IN
335800HM9RWBXAB2KD54,INVESTOXPERT ADVISORS PRIVATE LIMITED,"1449, 133, 436, 441, 450, 451, NO133 GALI NO 2","nan, East Gokalpur, Gokalpur, 1449/133, KH.NO-436-441, 450&451, PROP.NO133 GALI NO 2 LONI RD, DURGA PURI, NORTH EAST DELHI",DELHI,IN-DL,110093,IN
984500A6E65711J39D16,OCIOR GREEN FUELS PRIVATE LIMITED,"26, 36","nan, East Patel Nagar, Patel Nagar, 26/36, Basement",New Delhi,IN-DL,110008,IN
3358008B5NEGOGREPC28,PRACHI INFRA AND ROADS PRIVATE LIMITED,"17, 18, 3RD","nan, East Punjabi Bagh, Punjabi Bagh, 17/18, 3RD FLOOR",WEST DELHI,IN-DL,110026,IN
33580067F58D5SC5YD65,AJS EXPORTS,"1ST, 1120","7260, Bandra Kurla Complex Road, East, 1ST FLOOR, DC-1120, D TOWER, BHARAT DIAMOND BOURSE, BANDRA-EAST, MUMBAI SUBURB, BANDRA-EAST",Mumbai,IN-MH,400051,IN
335800FBRL48U7MD6D87,LOYLTY REWARDZ MANAGEMENT PRIVATE LIMITED,2ND,"Andheri - Kurla Road, East, CHHIBBER HOUSE,  FLOOR, SAKINAKA JUNCTION, (EAST)",MUMBAI,IN-MH,400072,IN
335800ESYMKG5OY79R18,QUEST INVESTMENT MANAGERS PRIVATE LIMITED,"188, 25B","25, Sion Main Road, East, PLOT-188, GURUKRUPA, 25B, GUJARAT SOCIETY",MUMBAI,IN-MH,400022,IN
335800CQVHJ5NWFXJE09,DETPAK INDIA PRIVATE LIMITED,107,"8, Naigaon - Juchandra Road, East, SURVEY NO., RAJDEEP II, NH, VASAI, PALGHAR DISTRICT, VASAI, THANE",MUMBAI,IN-MH,401207,IN
98450075ECD2F0T5C275,CGG INFRA INDIA PRIVATE LIMITED,"VEGA 2, 177, 1","43rd Street, Easwari Nagar, Shankar Nagar, Pammal, VEGA 2E, PLOT NO. 177/1, ETERNIA APRTMENT",CHENNAI,IN-TN,600075,IN
9845007404FE93LF5112,RAAKII INFRA,"44, 936, 16, 489, 4","nan, Edapazhanji, T.C. 44/936 (Old T.C. 16/489/4), Edapazhinji",Thiruvananthapuram,IN-KL,695014,IN
8945007QDP4A7M4UIE62,MEZHUKKATTIL ENTERPRISES,"5, 396A, 6, 542","Aluva - Pukkattupady Road, Edathala, EDATHALA PANCHAYATH, 5-396A O, 6-542","ALUVA, ERNAKULAM",,683112,IN
335800OWIG4ZWUFVD665,ALLIANCE MARINE PRODUCTS,230,"nan, Edayar,  A, ERNAKULAM",ERNAKULAM,IN-KL,683110,IN
984500CED78D0AQ5F881,PRINCE ROADLINES,180A,"nan, Ekta Enclave, Peeragarhi Village, Paschim Vihar, , JANTA FLAT, PEERAGARHI",NEW DELHI,IN-DL,110087,IN
9845008M6E2A4CC55814,ESTRA ENTERPRISES PRIVATE LIMITED,6TH,"51, State Highway 49A, Elcot Sez, Sholinganallur,  FLOOR, TOWER C, TEK MEADOWS, NO., RAJIV GANDHI SALAI (OMR), SHOLING, ANALLUR",CHENNAI,IN-TN,600119,IN
335800ZDIHFWUWGCUS85,CMD CTR PRIVATE LIMITED,"Sector 119, 2, 502, 03, ELDECO AAMANTRAN SECTOR 119","FNG Expressway Service Road, Eldeco Magnolia Park, Sector 119, MP-2/502, GH-03, ELDECO AAMANTRAN SECTOR 119, GAUTAM BUDDHA NAGAR",NOIDA,IN-UP,201301,IN
335800VRARB9Z1NFGT60,B N MARLECHA & SONS,"10, 24A","Veerappan Street, Elephant Gate, George Town, 10/24A, VIJAY COMPLEX",CHENNAI,IN-TN,600079,IN
9845005A3967642FA094,ZORA TRADERS LIMITED,B 2,"Ellis Bridge, Ellisbridge, A & ND FLOOR, GUJARAT BHAVAN, OPP M.J.LIBRARY, ASHRAM ROAD",AHMEDABAD,IN-GJ,380009,IN
335800A6S7SJMC6M7453,JEVIN STOCK BROKER PRIVATE LIMITED,54,"Chimanlal Girdharlal Road, Ellisbridge, B-, PARISIMA COMPLEX, OPP. I.F.C.BHAVAN, OPP. VAISHALI COMPLEX, C.G.ROAD, NAVRANGPURA",AHMEDABAD,IN-GJ,380006,IN
8945005PUXHOJDPPBQ71,ALB STOCK BROKING PRIVATE LIMITED,"203, 2, 4","nan, Ellisbridge, SHAAN-203, NR. SAKAR-2, OPP. TOWN HALL B/H. SAKAR-4",AHMEDABAD,,380006,IN
98450061I7FD1BHAUF45,VINEY SHOETECH PRIVATE LIMITED,132,"nan, Engineers Enclave, Harsh Vihar, Pitampura, , Saraswati Vihar",Delhi,IN-DL,110034,IN
984500A9P7D94A59B074,SHRI DURGA INFRAVENTURES LLP,"189, PHASE 1","GMS Road, Engineers Enclave, Kanwali, 189 ENGINEERS ENCLAVE, PHASE 1",DEHRADUN,IN-UK,248001,IN
3358009GRDDJY8U8UU32,VRM MOLECULAR AND NUCLEAR MEDICINES PRIVATE LIMITED,"Scheme No 54, 21, 54","nan, Entrance, Scheme No 54, 21-G, F-SCHEME NO.54, OPP.MEGHDOOT GARDEN",INDORE,IN-MP,452010,IN
8945003VCCA0RF5UNQ27,SBM SPACE REALTY LLP,"Office No 1 to 3 Sr No 3, 1, 3, 2, 3, 3, 3, 4","nan, Erandwana Gaothan, Erandwane, Matai Chambers, Mhatre Bridge Main Road, Erandwana Goathan, First floor, Office No 1 to 3 Sr No 3/1, 3/2, 3/3, 3/4, Erandwana",PUNE,,411004,IN
894500AJ2U8DPFXWFQ95,MALABAR MULTI SPECIALITY CENTRE PRIVATE LIMITED,"2, 1854","nan, Eranhippalam, 2/1854 A, MALABAR HOSPITALS BUILDING CIVIL STATION PO ERANHIPALAM",KOZHIKODE,,673020,IN
3358002BMYJFNTRQ7M61,ERYTHRO PHARMA PRIVATE LIMITED,212,"nan, Erragadda, FLAT NO., BHANU ENCLAVE, NEAR E.S.I. HOSPITAL",HYDERABAD,IN-TS,500038,IN
984500A8E0BC6FWBA422,ECOKOSHINE CARBON PRIVATE LIMITED,"23, 55","23, Annamalai Nagar First Street, Ethiraj, West Mambalam, NO. 23/55",CHENNAI,IN-TN,600033,IN
3358002UFPYIZRE33U28,DESTINY TRAVELS AND TOURS,"27, 27","nan, Evershine Millennium Paradise, Thakur Village, Kandivali East, SHOP NO.27, BLDG NO.27, NEPTUNE BLDG, EVERSHINE MILLINIEUM PARADISE, KANDIVALI-EAST, MUMBAI",MUMBAI,IN-MH,400091,IN
9845000803A83ET0C832,VENKATESH TRADERS,F 3,"nan, TRADERS COMPLEX, OPP. LABOUR COURT, VASANT MARKET YARD",SANGLI,IN-MH,416416,IN
8945004J1YU92JZ9FA59,SHREE SALASAR BALAJI CREATIONS LLP,"F NO 701, A26, F1 AND F2","nan, F NO 701, SHRI VILLAAPT, A26, F1 AND F2 KANTI CHAND ROAD",JAIPUR,,302006,IN
9845008B01403CC9C436,LOKESH POWER INFRA PRIVATE LIMITED,155,"nan, F, Hans Vihar, RIICO Industrial Area, Mansarovar, PLOT NO. F-, JHOTWARA EXTENSION, SARNA DUNGAR",JAIPUR,IN-RJ,302013,IN
33580057HQFNQ38Y3K80,DAFFOHILS LABORATORIES PRIVATE LIMITED,"109, 110","nan, F- UPSIDC INDUS., AREA SELAQUI",DEHRADUN,IN-UK,248011,IN
984500AAABCD46229B47,SHARMA MEDICAL CENTRE PRIVATE LIMITED,13,"Street Number 13, F-, FIRST FLOOR, VIJAY CHOWK, LAXMI NAGAR",DELHI,IN-DL,110092,IN
335800JNZRX9XAJZHK38,TODWAL UDYOG,49 TO 51,"nan, F-, INDUSTRIEL, AREA, NEWAI, TONK",TONK,IN-RJ,304021,IN
335800Z96VJX6JLREA44,SILVER EX METALS,631,"nan, F-, RIICO INDL. AREA KHUSHKHERA, BHIWADI, ALWAR, RAJASTHAN",ALWAR,IN-RJ,301707,IN
894500AKRT9TQ8KKMU08,KAMESHWARA TECHNOLOGIES LLP,"G1, PT 243, 266 SY 78","nan, F-, GOKUL SERLINGAMPALLY",HYDERABAD,,500019,IN
9845002A94Y1CF076385,PURITHA EXIM PRIVATE LIMITED,"407, 4TH","nan, F.NO. FLOOR, APARNA GREEN, NANAKRAMGUDA SERILINGAMPALLY MANDAL RANGA REDDY",Rangareddi,IN-DL,500032,IN
335800JEOK47IBTKQL23,SAMS INDUSTRIES PRIVATE LIMITED,"P No 75, 2ND","nan, F.P No 75, Jambli Gully, Borivali West, 2ND FLOOR, A WING, FORTUNE AVIRAHI JAIN DERASARLANE, BORIVALI (WEST), MUMBAI CITY, MUMBAI, MAHARASHTR",MUMBAI,IN-MH,400092,IN
98450008C6B40E10AC14,SATHYAM TRADERS,"11, 14","nan, FIRST FLOOR, 11/14, ESHA APARTMENTS, PVR STREET",NAMAKKAL,IN-TN,637001,IN
335800MVDYR3J8CDRH26,CHAI SUTTA BAR PRIVATE LIMITED,OPPOSITE C21,"AB Road, FIRST FLOOR, RED SQUARE,  MALL",INDORE,IN-MP,452010,IN
33580066M4XRGAPOEW85,HETVA ENTERPRISE PRIVATE LIMITED,FL NO 801 8,"nan, TH FLOOR, BHASKAR TOWER SARTHANA",SURAT,IN-GJ,395006,IN
25490051EF6N6M0LWC68,WEST POINT INDUSTRIES LLP,"FLAT NO 1001, 10TH","Kalavad Road, FLOOR, RAVI HAVEN, AVADH, KALAWAD, VIRDA VAJDI IN",RAJKOT,IN-GJ,360005,IN
335800LY2LEWU33EF706,PLATINUM TOBACCO EXPORTS PRIVATE LIMITED,"FLAT NO 102, 5TH","nan, FLAT NO 102 INETSOLVS, MAGNOLIAAPPARTMENTS, 5TH LANE, CHANDRAMOULINAGAR",GUNTUR,IN-AP,522007,IN
89450083RXW2QZUCFQ71,WEALTHY CROP SCIENCE PRIVATE LIMITED,"601, BLDG NO 3","nan, FLAT NO C/601 INDUS, BLDG NO 3 PALGHAR",PALGHAR,,401501,IN
33580067D98XQGAAYP05,SOLITAIRE IMPEX GENERAL TRADING COMPANY,"706, 19","nan, FLAT NO-706 E WING, BLISS, PLOT NO, AM-19, ADDL MIDC, AMBERNATH",THANE,IN-MH,421501,IN
984500837372DF78C650,SAI CANCER AND RESEARCH SERVICES PRIVATE LIMITED,102,"nan, FLAT NO. , RIYATEZ APARTMENT FULARI MALA",Ahmednagar,IN-MH,414001,IN
