RegistrationNo,CompanyName,BuildingNumber,StreetName,TownName,CountrySubDivision,PostCode,Country
984500B6C74F7FRED606,ARYANA BLACKSTONE CONSTRUCTION PRIVATE LIMITED,"9, 1st, Sec 14","nan, Shop No. 9, Pocket-B, 1st Floor, Sec 14",Hissar,IN-HR,125001,IN
8945008PN1V3ECP7CM85,NOVEM INDUSTRIES LLP,"1, Office 408, Near Sanidhya 253","Field Marshal Road, Shop No.1, Mota Mava, Office 408, Fortune Imperia, Near Sanidhya 253, New Ring",RAJKOT,,360005,IN
8945005VK0T35OX8JA04,Colors Fab,"8, 14","nan, Shop No., Navyug House, Old Hanuman Lane",Mumbai,,400002,IN
894500B4XY7ECSSRCM11,EQUIRIZE SECURITIES PRIVATE LIMITED,"Shop no 2, Sector 15, 301","Village, Shop no 2, Sector 15, CBD Belapur, 301, chawla Complex",Thane,,400614,IN
6488Q3PWM2S6854BE639,BABA NARSINGH DAS BUILDCON PRIVATE LIMITED,"130, 9","nan, Shop no. s-130 first floor block no. b, cc-9, com. complex, v. b. mart, Neemrana, Rajasthan",Alwar,,301705,IN
335800GMB55BODFGTE83,SPAN APPARELS PRIVATE LIMITED,SPAN HOUSE STADIUM CIRCLE 7,"nan, Shreyas Colony, Navrangpura",AHMEDABAD,IN-GJ,380009,IN
9845005D3CEEEBA39690,ADINTEREST MARKETING SOLUTIONS PRIVATE LIMITED,"5, 137","Road, Shubham Enclave, Reserve Bank Enclave, Paschim Vihar, A-5 B/137, DDA Flats",DELHI,IN-DL,110063,IN
98450080155EFFD99C24,KAPOOR TIMBER SUPPLIER PRIVATE LIMITED,47,"80/47-B, Malviya Nagar Road, Shvalik, DDA Flats, -A, CORNOR MARKET",NEW DELHI,IN-DL,110017,IN
8945008A37EJX8DE9I54,K K INFRASTRUCTURE,J 101,"nan, Shyam Enclave, Janak Puri, , NR SHREE RAM CHOWK",NAVA NARODA,,382330,IN
8945009X7Q9D2331IU69,RAJYASH INFRAWORLD LLP,305,"nan, Shyamal, , MAURYANSH ELANZA, SHYAMAL CROSS ROAD, NR PAREKH HOSPITAL",AHMEDABAD,,380015,IN
6488SW5Q3LD8692YA451,BLASTO METAL SPRAY PROCESSORS PRIVATE LIMITED,10,"10, 6th Right Street, Sidco Industrial Estate, Manikanda Puram, Thirumullaivoyal, Plot/No., RIGHTSTREET MANIGANDAPURAM, THIRUMULLAIVOIL, Tamil Nadu, India",CHENNAI,,600062,IN
98450087TB0766E64C88,HOME JUNCTION PRIVATE LIMITED,"25th, 2502 561","nan, Siddha Eden, Stream Tower, 25th Floor, Fl-2502 561, Lake View Park",Kolkata,IN-WB,700108,IN
9845001D5FD3D8805873,ASSOCIATED ALUMINIUM PRODUCTS PRIVATE LIMITED,1,"nan, Siddharth Nagar, Worli, B-, TULSI VIHAR, DR.A.B. ROAD, WORLI NAKA",MUMBAI,IN-MH,400018,IN
984500C5F10B96705B23,HARDAYAL ICE AND COLD STRAGE PRIVATE LIMITED,371,"Chhimara Road, Siddharthpuri, , CHIMMARA, VILLAGE NILOI, Jaswant Nagar",Etawah,IN-UP,206245,IN
335800E6GO25XW3TPI38,PROCUREYARD TECHNOLOGY PRIVATE LIMITED,"56, 4008, 2704, 597, FLOOR 1","Jain Road, Sidhatri Enclave, Mohan Garden, Nawada, HOUSE NO A-56, KHASRA NO, 4008/2704/597, FLOOR 1ST, ESI, WEST DELHI, NEW DELHI",NEW DELHI,IN-DL,110015,IN
3358004CCDWLNZYSCG83,EVARA SPACES LLP,"5TH, ULHASNAGAR 1","nan, Sidhi Vinayak Nagar, 5TH FLOOR, SAI SHARAN, KALYANI COMPLEX, GOAL MAIDAN, ULHASNAGAR 1",KALYAN,IN-MH,421001,IN
984500598C01EB65F687,BALAJI AGRO FOODS,14,"nan, Sikandra, E-, SITE-C, UPSIDC INDUSTRIAL AREA",AGRA,IN-UP,282007,IN
335800BC2DV2264HVE76,FASHION SAFETY FOOTWEAR PRIVATE LIMITED,90,"nan, Sikandra, E-, UPSIDC SITE C SIKANDRA",AGRA,IN-UP,282007,IN
894500BA6EVI260NLI71,PARAGON GRAPHIC SOLUTIONS PRIVATE LIMITED,"14, 3","Transport Road, Sikh Village, Bowenpally, PLOT NO. 14, FLAT NO. G - 3, SRINILAYA APTS, SBI COLONY, SIKHVILLAGE SECUNDERABAD",Secunderabad,,500009,IN
335800WQNJ2NIKBG7M54,ESSEN AUTOMOBILES,"PLOT NO 614, 2371","nan, Sikharpur, PLOT NO 614/2371, CUTTACK",CUTTACK,IN-OD,753003,IN
335800S3AKU5V57EVF11,TRIMURTI HOSPITAL,"25, 221, 1","nan, Sikraul, S.25/221-A-1, SARSAULI",VARANASI,IN-UP,221002,IN
8945005GB9G2YJ96RA15,REDDYS DIGITAL PRIVATE LIMITED,"Plot No 10, 1","nan, Silver Oak Bungalows, Cherlapalli, Plot No 10, I D A Cherlapally, Phase-1, Kapra Mandal, Rangareddi, Hyderabad, Telangana",HYDERABAD,,500051,IN
984500D70CXFDCCF8840,VARUN NAMBIAR FAMILY TRUST,"1002, 46, 1","Promenade Road, Sindhi Colony, Frazer Town, FLAT NO. 1002, EMBASSY OASIS, 46-1, PULIKESHI NAGAR, NEAR ULSOOR LAKE",Bangalore,IN-KA,560005,IN
3358001UPSBBIQICGT04,RUKHMANI COTTEX,"232, 5","Main Road, Sindhi Colony, SURVEY NO.232, PLOT NO.5, RUKHMANI COTTEX, AT NANDGAON, HINGANGHAT, WARDHA, MAHARASHTRA, HINGANGHAT",WARDHA,IN-MH,442301,IN
984500E51C62BT3FF873,EUTECTICAL ENGINEERING PRIVATE LIMITED,"1203, 7TH","nan, Sindhu Wadi, Ghatkopar East, 1203, RAMESHWAR CHS, 7TH ROAD, NEELKANTH VALLEY, GHATKOPAR",Mumbai,IN-MH,400077,IN
89450092VR34AR2TME62,E-LAND APPAREL LIMITED,"16, 2B","nan, Singasandra, #16/2B, Sri Vinayaka Indl Estate, Singasandra Near Dakshin Honda Showroom House Road",Bangalore,,560068,IN
8945006Q732V6ZL7QU10,YASHRAM LIFESTYLE BRANDS PRIVATE LIMITED,"58, 2A, 27","nan, Singasandra, No.58/2A/27, Begur Hobli, Begur, Bangalore, Bangalore South",BENAGLURU,,560068,IN
984500D7F2DAB3B0D690,ROSHNI DEVELOPERS & REALTORS PRIVATE LIMITED,"6, 1A","Swamy Vallabhdas Road, Sion West, Sion, B-B-6-A, Floor-Grd Plot-1A, B, Basant Court, Swami Marg, Sadhana Vidyalaya",Mumbai,IN-MH,400022,IN
335800G1JOWX1QJ3NP84,PROM MACHINING SOLUTIONS INDIA PRIVATE LIMITED,"Sipcot Ph 2, 32","nan, -C TITAN JEWELLERY ROAD, SIPCOT INDUSTRIAL COMPLEX, KRISHNAGIRI",HOSUR,IN-TN,635126,IN
984500E0CE1AFDEB0690,SAARVAM INDUSTRIES LLP,2241,"nan, Sitapura, North-West Corner Room of the Premises i.e, F- RIICO Industrial Area, Ramchandpura, Sitapura Ext.",Jaipur,IN-RJ,302022,IN
984500FE155EBE7FK722,BANDARU AGROTECH PRIVATE LIMITED,"14, 131","nan, Sitarampuram, 14-131, Seetharam Puram, Miryalguda",Nalgonda,IN-TS,508207,IN
98450014CZEFEEB4CF92,R.D.P CONSTRUCTION,223,"nan, Siwandih, PLOT NO. , BARI CO-OPERATIVE COLONY, Bokaro Steel City",Bokaro,IN-JH,827012,IN
335800NLW73AHEBKKP39,JAYHIND STEEL SYNDICATE,"1001, 2","Science City Road, Sola, 1001 - THE CAPITL - 2",AHMEDABAD,IN-GJ,380060,IN
984500C8UAF63154H008,MARUTI DHAROI BRIDGE PRIVATE LIMITED,"1101, THE CAPITAL 2","10, Science City Road, Sola",Ahmedabad,IN-GJ,380060,IN
894500AW5ZWMYUZN1Y61,SADASHIV PROJECTS INDIA PRIVATE LIMITED,"706, 2","10, Science City Road, Sola, 706, THE CAPITAL-2, Ahmedabad, Ahmedabad, Gujarat",Ahmedabad,,380060,IN
8945005W6705PM8R5I39,SHREE YOGI NAREYANA EDUCATION TRUST,"38, 5","nan, Sollepura, #38/5, ANEKAL, ADIGONDINAHALLI ROAD",Bangalore South,,562107,IN
9845008BZ00809BE8082,BALAJI MEDICALS & GENERAL,"1st, 6, 3, 920, 3","nan, Somajiguda, 1st Floor, 6-3-920/C, Shop No. 3, Maruthi Appartments",Hyderabad,IN-TS,500082,IN
335800RMVUIHGTVGRO78,RISHIK KRISHNA AND ARJUN KRISHNA INDUSTRIES,104,"Raj Bhavan Road, Somajiguda, FLAT NO. , LAKE RESIDENCY, SOMAJI GUDA, KHAIRTABAD",HYDERABAD,IN-TS,500082,IN
335800ORMFFRYKCH1712,SOLITECH GREEN ENERGY PRIVATE LIMITED,204,"Surat - Kamrej Highway, Somanath Society, Kapodra Patiya, , MADHAVBAG COMPLEXKAPODRA",SURAT,IN-GJ,395006,IN
6488HUWJE8S8Z7808903,VANAAM TIMBERLINE,"5th, 23, 917, 1","nan, Somasekara Puram, 5th Floor, 23/917/1, Aditi Crystal, Dhandhayudha Puram, Madras Bus Stand, SPSR Nellore District",Nellore,,524001,IN
9845003DA4C96DEABA15,ADDYA SAKTI COLD STORAGE PVT LTD,"2B, 2ND","nan, Somaspur, ROOM NO.  FLOOR, VILL: SOMASPUR, DHANIAKHALI",Hooghly,IN-WB,712302,IN
3358009VJ4V15RSL4I75,INVIOT AV SOLUTIONS PRIVATE LIMITED,"40, 3246, 9","Palarivattom - Edappally Road, Sonia Nagar, NO.40/3246-C, 9 TH FLOOR, S.L PLAZA",ERNAKULAM,IN-KL,682025,IN
8945009GW61ZE23U5Y38,JAI SHREE KRISHANA CEMENTS,27,"nan, Sotanala, PLOT NO. G-, INDUSTRIAL AREA",ALWAR,,301701,IN
89450074Z7SKH79MK608,K.N.MISHRA CONSTRUCTIONS (INDIA) PRIVATE LIMITED,1268,"nan, Soubhagya Nagar, Baramunda, PLOT NO- SIRIPUR BHUBANESWAR",BHUBANESWAR,,751003,IN
33580018NAX8SHKRW222,ELFRICK HEALTHCARE PRIVATE LIMITED,"802, 1","Safal Parisar Road, South Bopal, Bopal, F-802, ORCHID PARADISE, PARISAR-1, DASKROI",AHMEDABAD,IN-GJ,380058,IN
9845001D1PD0FF4FR593,GREEN HAVEN DEVELOPERS LLP,"Sector 49, 53, 2","nan, South City II, Sector 49, E-53, GROUND FLOOR, SOUTH CITY-2",Gurgaon,IN-HR,122018,IN
648867MM81N0RN7DB071,GANDAS INDUSTRIES PRIVATE LIMITED,"Sector 49, 126, H SOUTH CITY 2","nan, South City II, Sector 49, PLOT NO. 126 BLOCK-H SOUTH CITY 2, Haryana, India",Gurgaon,,122018,IN
335800CTWCN94EBBQ914,STELLAR HORIZON NAVIGATOR LLP,"654, 3","nan, South Kalamassery, Kalamassery, DOOR NO. 654/3, AH BUILDING TVS JUNCTION, KANAYANNUR",ERNAKULAM,IN-KL,683104,IN
335800FMGZYK1WO94I36,OSIAN KALTECH LLP,57,"57, Narayana Mudali Street, Sowcarpet, George Town, NO., CHENNAI",CHENNAI,IN-TN,600079,IN
335800YMPQFI3RB4D718,MLR INFRASTRUCTURE PRIVATE LIMITED,40,"nan, Sowjanya Colony, Bowenpally, PLOT NO., SANJIVIAH NAGAR, HYDERABAD",SECUNDERABAD,IN-TS,500011,IN
254900DUXL829AFKU139,ASTRON ZIRCON PRIVATE LIMITED,"606 TO 608, 5","Sarkhej - Gandhinagar Highway, Spring Valley, Mumatpura, OFFICE NO. 606 TO 608, SHAPATH -5, OPP. KARNAVATI CLUB, S.G., VEJALPUR",Ahmedabad,IN-GJ,380051,IN
64887334MJ97PYZ4TE70,GLOBAL SPIRITS,"5, 503","GS Road, Sree Nagar, , ORION PLACE, G S, MIZORAM HOUSE, CHRISTIAN BASTI","Dispur, Kamrup Metropolitan",,781005,IN
984500E2C2A0365ARE66,HK ENTERPRISES,"1, 55, 177","nan, Sree Prabhupada Township, 1-55/177/CM/B, Cyber Meadows, GACHIBOWLI, Kondapur, Rangareddy",Hyderabad,IN-TS,500084,IN
9845007488TD09B9E653,VEEKSHITHA HOSPITALITY PRIVATE LIMITED,1ST,"403/1, Dakshindari Road, Sreebhumi, (ALCOVE GLORIA),  FLOOR, Patipukur",North 24 Parganas,IN-WB,700048,IN
984500A09SEFQB7C7110,CHINSURAH ABACUS EDUCATIONAL SOCIETY,"1ST, 7","Sarat Bose Road, Sreepally, Bhowanipore, 1ST FLOOR, DWARKA BUILDING, 7",KOLKATA,IN-WB,700020,IN
984500E77E5689D07765,ABACUS ACADEMIA,"7, 1B","Sarat Bose Road, Sreepally, Bhowanipore, 7, DWARKA BUILDING, 1B",KOLKATA,IN-WB,700020,IN
984500HE5643B941R888,SMOTT Entertainment LLP,"1, 139","nan, Sreeram Nagar Colony, Flat no. G-1, PT. No. 139/, Rangareddy",Puppalaguda,IN-TS,500089,IN
9845006A45V3DD9BE916,SYSMEC ENGINEERING AND CONSTRUCTIONS PRIVATE LIMITED,"403, 59, 60","nan, Sri Balaji Layout, Gajularamaram, FLAT NO. 403, PLOT NO. 59 & 60, PNR RESIDENCY, RANGAREDDI",Hyderabad,IN-TS,500055,IN
6488Z1U1AZU8E8811D04,SATYA DISTRIBUTORS,"8, 3, 677, 57","nan, Sri Krishna Devaraya Nagar, Navodaya Colony, Yella Reddy Guda, 8-3-677/57, SRI KRISHNADEVARAYA NAGAR, YELLAREDDYGUDA",HYDERABAD,,500073,IN
9845005CAQB7D843O665,MAGNOT CONSULTANCY SERVICES PRIVATE LIMITED,"2LH, 1104","Lanco Hills Road, Sri Laxmi Nagar Colony, , Manikonda, Puppalaguda, Rangareddi",Hyderabad,IN-TS,500089,IN
9845001ADBF41ED64082,REALTYSHIELD SERVICES PRIVATE LIMITED,"FLAT 401, 4th, 1, 10, 4, 1, 10, 4A, 1, 10, 4B","Hitech City Road, Sri Sai Nagar, Madhapur, FLAT 401, 4th FLOOR, OYSTER UPTOWN BUILDING, 1-10/4, 1-10/4A, 1-10/4B",HYDERABAD,IN-TS,500033,IN
3358005LS67J6SA1CV71,FRUGALHACKS PRIVATE LIMITED,"21, 2ND","53/A, Road Number 2, Sri Shyam Nagar, Telecom Nagar, Gachibowli, PLOT NO.  FLOOR, GARDENIA MABUHAY JAYABHERI PINE VALLY, TELANGANA -",GACHIBOWLI,IN-TS,500032,IN
984500CD46D9EM77DF55,SAKETH SOLAR ENERGY LLP,"8th, 47, 1st, 7th","nan, Srinidhi Layout, 8th Phase, J. P. Nagar, No. 47, 1st Floor, 7th Main, Srinidhi Layout Konanakunte",Bangalore,IN-KA,560062,IN
335800ARQMYMQ8LAZ835,Q HESTIA TECHNOLOGIES PRIVATE LIMITED,"22, 5TH","Kengal Hanumanthaiah Road, Srinivas Colony, Sudhama Nagar, HARA CHAMBERS, # FLOOR, KH",BANGALORE,IN-KA,560027,IN
984500A88E7998096983,KISSAN AGRI MALL PRIVATE LIMITED,"51, 917, C3, 1","Rtc Bus Stand Road, Srinivas Nagar, 51-917-C3-1, SVR Complex, Opp.",Kurnool,IN-AP,518005,IN
98450007B2BE6AT0NE15,M/S RAAYALASEEMA HOSPITALS,"25, 604","nan, Srinivasnagar, Banashankari, 25-604, SRINIVASA NAGAR",NANDYAL,IN-AP,518501,IN
9845008BR8F4FDB2FF87,NITAI PRESS CAMP PRIVATE LIMITED,20,"nan, Sterling City, Bopal, , MARUTINANDAN CO. OP. SOC., NR. STERLING CITY CLUB",AHMEDABAD,IN-GJ,380058,IN
3358005TS62IOERK9289,SILOAM CHARITABLE TRUST,NO 40,"2nd Cross, Subanna palya, harsh layout, banaswadi, , SUBBANNAPALYA, BANSWADI POST",BANGALORE,IN-KA,560033,IN
984500BD5R2EW5EC0087,ETHICS INFOTECH LLP,"901 to 903, 9th","Doctor Vikram Sarabhai Marg, Subhanpura,  Floor, Neptune Edge",Vadodara,IN-GJ,390007,IN
3358007CXXAEF1PFAD30,M/S. VENKATESHWARA TEXTILES,"2, 1, 85, PART 2, 1, 86, 2, 1, 87 AND 2, 1, 88","nan, Subhash Gunj, 2-1-85/PART 2-1-86, 2-1-87 AND 2-1-88 MAIN ROAD, ZAHEERABAD MEDAK",SANGAREDDY,IN-TS,502220,IN
33580016FAO62P92SY96,DDEV SPICES PRIVATE LIMITED,00,"Mill Road, Subhash Nagar,  B/S KIRAN WARD OLD COMPOUND, KHEDA",NADIAD,IN-GJ,387001,IN
335800M94ZNK6JQ4ZK24,RAYBE INDUSTRIES PRIVATE LIMITED,806,"Surat - Kamrej Highway, Subhash Nagar, Nana Varachha, , BLUE POINT, OPP D-MARTSARTHANA JAKAT NAKA",SURAT,IN-GJ,395006,IN
3358007QN1927HBKWR10,KRISHNA RAJARAM ASHTEKAR AND COMPANY,SR NO 1056,"Lokmanya Bal Gangadhar Tilak Road, Subhash Nagar, Shukrawar Peth, , KRA HOUSE, PUNE, MAHARASHTRA",PUNE,IN-MH,411030,IN
335800XIW6EO1LJVG697,PREMIUMBIZ PRIVATE LIMITED,246 FLAT NO 206,"nan, Subramanyapura,  SHIVAPARADIS, SUBRAMANYAPURAUTTARAHALLI, BANGALORE SOUTH",BANGALORE,IN-KA,560061,IN
6488J806EKT87K2ZC448,SATISH ENTERPRISES,102,"Gubbalala Main Road, Subramanyapura, Ground Floor, , VD Mansion, Hone Marada Raste, Karishma Hills Guballala, Karnataka",Bengaluru,,560061,IN
335800BX51BA2U6SK166,SCIENTIFIC RESEARCH INSTRUMENTS COMPANY PRIVATE LIMITED,"42, 43, 2ND, 3RD, 1ST","Gubbalala Main Road, Subramanyapura, NO.42&43, 2ND&3RD FLOOR, 1ST CROSS, RAGHAVENDRA RESIDENTIAL LYT, RD, GUBB, ALALA",BANGALORE,IN-KA,560061,IN
3358004EBJA74B2YZT43,M R INFRAA,"SY NO26, 2","Vasanthapura Main Road, Subramanyapura, SY NO26/2, ADJ TO NIVEDITHA SCHOOL, BANGALORE, BENGALURU URBAN",BANGALORE,IN-KA,560061,IN
6488319KFJQ4XY91F008,KHEMKA INDUSTRIES,"1, 1","nan, Sudama Nagar, Dombivli East, Plot No. F-1/1/B, MIDC Phase II, Near Khandelwal Weigh Bridge, Maharashtra",Akola,,444104,IN
335800W89BXYOOBNLE37,STERLING FABRICATING ENGINEERS PRIVATE LIMITED,48,"nan, Sudama Nagar, Dombivli East, W-, M.I.D.C, PHASE-II, DOMBIVALI (EAST)",THANE,IN-MH,421204,IN
8945004LZA9U778YUU96,DRA METRO CITY PRIVATE LIMITED,"109, 111, 113, 76, 1, 77, 78","nan, Sudandira Nagar, Royapettah, New No.109, 111 & 113, Old No.76/1, 77 & 78, Lloyds Road, Avvai Shanmugam Salai",CHENNAI,,600014,IN
894500AR8MC2JGFI4602,POORNIMA CLOTHING INC,"3, 1, 4TH","Siddaiah Road, Sudhama Nagar, BHIKSHU SADAN, 3/1, POORNIMA CLOTHING INC, 4TH CROSS, H",Bengaluru,,560027,IN
33580022AJC41TVPKF23,VISAKA MOTORS,100,"100b, Barrackpore Trunk Road, Sukchar, Jaiprakash Nagar, Sodepur, /B, B.T.ROAD GIRJA",NORTH TWENTY FOUR PARGANAS,IN-WB,700115,IN
64882O53JQ6OZ1N6R118,MODERN METALS INDIA PRIVATE LIMITED,246,"nan, Sukhdev Vihar, Okhla, H NO.  THIRD FLOOR SUKHDEV VIHAR, Delhi",NEW DELHI,,110025,IN
335800TXOWJJJ1OJ6D52,FIBERTECH COMPOSITE PRIVATE LIMITED,"20, 21","20, Kotda Sangani Road, Sukhnath Naga, Bargati Pura, SURVEY NO. 20/21",PIPALANA,IN-GJ,360030,IN
335800F2VPT3RTDRDB11,M M ENGINEERS PRIVATE LIMITED,15PONNUSWAMY,"15, Ponnusamy Road, Sukrawar Pettai, Ranganathapuram,  COIMBATORE, COIMBATORE, TAMIL NADU, INDIA",COIMBATORE,IN-TN,641002,IN
64880726DRBATG738T21,SESHADRI DALL MILL,"32, 2, 7, PLOT NO B3","nan, Sulthanabad, 32/2/7, PLOT NO B3, SULTANABAD, Guntur",TENALI,,522202,IN
9845007073DC9A1CCC81,KENANGAN COFFEE PRIVATE LIMITED,"54, 3rd, 53, Next to 54","B-54, Golf Course Road, Suncity, Sector 54, Haiderpur, Golf Course Road, Suncity, 54, 3rd Floor, Orchid Centre Near IILM Institute, 53, Next to 54, Dlf Qe",Gurgaon,IN-HR,122002,IN
98450009CFC675547C77,POWERWIND PROJECTS PRIVATE LIMITED,"Sector 54, 411, 4th, 54","Golf Course Road, Suncity, Sector 54, Unit No. 411, 4th Floor, Suncity Business Tower, Sector-54",Gurgaon,IN-HR,122003,IN
335800BS5I2LMKB2GE87,DHOLAKIYA & SALIA ASSOCIATES,806,"Gulmohar Road, Sundar Nagar, Borivali West, , SHEELA APARTMENT, OPP AJANTA TALKIES",MUMBAI,IN-MH,400092,IN
8945002RXBPHC6OR5I03,4HEALTH LLP,"37, 2","nan, Sundar Nagar, Naranpura, 37, SUDARSHANSOCIETY.NO.2.NARANPURA",AHMEDABAD,,380013,IN
335800VJ1B5S4XZTIM47,TMV INFRAHEIGHTS LLP,"G 3, G 4","16, Amrapali Marg, Sunder Nagar, Vaishali Nagar, , TAMANNA TOWER",JAIPUR,IN-RJ,302021,IN
984500D96H0BS978BE97,CEE DEE DEVELOPERS PRIVATE LIMITED,"SCO 159, 160, 1st","Sector 117, Kurali road, Sunny Enclave, SCO 159-160, 1st FLOOR, TDI CITY AIRPORT, KHARAR (RUPNAGAR)",S.A.S. Nagar,IN-PB,140307,IN
335800EBYBOA6POMJS90,SHREE NIDHI INDUSTRIES,"PLOT NO A1, 74, 75, 76, 77","nan, Sursez, GIDC, Sachin, PLOT NO A1-74, 75, 76, 77, DIAMOND INDUSTRIAL PARK, RAILWAY LINE ROAD",SURAT,IN-GJ,394230,IN
894500AN8I23XXUN3Q88,Plastotech India Private Limited,Survey No 176,"Dungara Road, Panjroli, On Dungra",Bharuch,,394120,IN
9845007E6E07F3HCF787,CAPCO POLYPACK LLP,125P3,"nan, Survey No. , Pipliya Fagashiya Road, Village: Pipliya, Morbi, Pipaliya, Dahisara",Rajkot,IN-GJ,363660,IN
984500DB701F68J15643,PEACHERY LLP,"168, 1, 1, 2","nan, Survey No. 168/1/1/2, Karadiya Nawakheda, M.L.Nagar",Ujjain,IN-MP,456010,IN
984500ZA0A7A0CEC9B27,B R INFRACON,"232, 25","Ring Road, Survey No. 232, Plot No. 25, Vaishnav Devi Circle, S.P, Opposite Hillock Hotel, Tragad",Ahmedabad,IN-GJ,382470,IN
9845001DDZ6BAB4JIE92,AVANTIKA MICRONS LLP,239,"nan, Survey No. , B/H Nessa Vitrified LLP, Matel Road, Lakaddhar, Matel, Wankaner",Rajkot,IN-GJ,363621,IN
9845008F95A98ABA7A32,CALSTONE MINERALS LLP,"300, 3, p1, p2 and 300, 3, p1, p3","nan, Survey No. 300/3/p1/p2 and 300/3/p1/p3, Near Lutavadar Fatak, Lutavadar, Morbi MDG",Rajkot,IN-GJ,363641,IN
98450044E60E0038EE78,PASHUPATI COTYARN LLP,"404, 1","Kadi - Detroj Road, Survey No. 404/1, Moje:Balasar, Taluka-Kadi",Mahesana,IN-GJ,382715,IN
9845004D069752B75451,M/S UDAY AGRO TECH,98,"nan, Survey No. , Hajipur Jitod Road, Sabar Kantha",Himatnagar,IN-GJ,383120,IN
6488XMWX9521KY1D2949,PEARL PROTEINS IMPEX,"28, 32, 21, 2 Paiki 1","nan, Survey no- 28/32, 21/2 Paiki 1, Fartikui, Vadodara",Dabhoi,,391110,IN
9845009675804E82EC13,SANDS TECHNOLOGIES,"40, 10C","nan, Surya Garden, First Floor, 40/10C, S&S Technologies, Vaigai Street, Near Ramakrishna School, Sri Kamadhenu Nagar",Coimbatore,IN-TN,641006,IN
335800TCBIO1LIM61R58,RAJASTHAN IRON COMPANY,"37, 6, 25","37-6-3, Tilak Street, Suryanarayana Puram, GROUND FLOOR, 37-6-25, KAKINADA, EAST GODAVARI",KAKINADA,IN-AP,533001,IN
335800FKL9QXQLK2JK63,KNY POWER RJ-02 PRIVATE LIMITED,"Sector 43, A 877","nan, Sushant Lok Phase I,  A BLOCK, SUSHANT LOKNEAR CHHAKARPUR CHOWKI, GURGAON, DLF QE",GURGAON,IN-HR,122002,IN
335800GLRGM8UJSAWW21,AJINKYA C T SCAN CENTRE,04,"nan, Suyog Nagar, Vidhya Vihar Colony, , WADI BHOKAR ROAD, DEOPUR",DHULE,IN-MH,424002,IN
335800I3AFJ7TPUTFZ17,AVALON RETAIL,"2ND, 6","Vasai Station Road, Suyog Nagar, West, 2ND FLOOR, A-6, GWEN QUEEN, APARTMENT, NEAR BISHOP, HOUSE, BHABHOLA, BARAMPUR, NAVGHAR MANICKPUR",VASAI VIRAR,IN-MH,401202,IN
98450070B6B8T6FDC630,AKSHAY CONSTRUCTION COMPANY,"427A, 5","nan, Swargate, Sr. No. 427A, Plot No. 5, Jinku Radiators LLP, Gultekadi Industrial Estate, Gultekdi",Pune,IN-MH,411037,IN
984500EFD4A103E84C87,VASUDEV STUUDIO PRIVATE LIMITED,"SY 60, 3, 11","nan, Swastik Park, Chembur, SY 60/3/A, PLT NO.11, GR. FLR, NR. CANCER HOSPITAL, VED GURUKUL RD.",SURAT,IN-GJ,395004,IN
9845009EE68B51YMED90,SURABHI INTEGRATED SERVICES,"1ST, 104","Balkampet Road, Swathi Avenue, Ameerpet, 1ST FLOOR, 104, KVR ENCLAVE, NEAR GURDWARA",Hyderabad,IN-TS,500016,IN
9845008BCCEAF406EE79,INDIAN-SEATS AND GUIDES PRIVATE LIMITED,19,"nan, Swati Park, Shree Khodiyar Krupa, Street No. , Kothariya",Rajkot,IN-GJ,360022,IN
8945009F770JD9H5YU11,Sri Hanuman Agencies,Sy No 1,"nan, Sarayyavalasa Village Dattirajeru Mandal",Vizianagaram District,,535580,IN
8945001ZLEO7VLYYRA91,Maheshwari Agro Industries,"Sy No 101 and95, 1C","1, Bibipet Road, Sy No 101 and95/1C, Janagama",JANAGAMA,,503125,IN
6488Q2EL85T3XM7E9925,GAJAKESARI INDUSTRIES,"186B, 2, 1 and 186, 2, 2","nan, Sy No. 186B/2/1 and 186B/2/2, Gollapalli, Jagtial, Telangana",Lothunur,,505425,IN
9845003B5C2JBCCL3B96,SREE ASSOCIATES,224,"nan, Sy. No. , QUARRY ROAD, PARITALA, KANCHIKACHERLA",KRISHNA,IN-AP,521180,IN
98450039D54BF4QE5084,SIFLON DRIP AND SPRINKLERS PRIVATE LIMITED,"31, 1D, 31, 2A","nan, Sy.No. : 31/1D & 31/2A, RACHANAPALLI VILLAGE, ANANTAPUR",Chittoor,IN-AP,515004,IN
6488VP3TCHGW37649703,GOURI SHANKAR AGRO FOODS,"298, 292C, 1, 298, 2","nan, Sy.No.298/B Sy.No.292C/1 Sy.No.298/C/2, Macharam Village, Penpahad Mandal",Suryapet District,,508213,IN
8945007I7X0LDLN8TY15,BHAVIKA PLAS-TEK PRIVATE LIMITED,"634, 638","nan, Sy.No.634 & 638, Rampally Dayara(V), Keesara(M), Medchal-Malkajgiri District.",Nagaram,,501301,IN
335800WK62V1W7YIV806,SANGATH PRO LLP,"T P 44, 12","nan, T P 44, Chandkheda, 12, SAUNDARYA FARM, NEAR RADHASWAMI SATSANG BIAS, B/H OMKAR BUNGLOWS",AHMEDABAD,IN-GJ,382424,IN
984500BK4F154A120E86,HARI OM ELECTRICALS,"49, 50, 1","Second VIP Road, T-49,50, Vesu, A/TF-1, SAI ASHISH TRADE CENTRE, NR. POONAYABHUMI",SURAT,IN-GJ,395007,IN
335800ZXXCHETHOEAT25,DOBBASPET DIAMOND PRIVATE LIMITED,7,"10, Raja Bather Street, T. Nagar, S -, KRISHNA ARCADE, II, FLOOR, RAJABATHAR ST, THYGARAYANAGAR",CHENNAI,IN-TN,600017,IN
335800G4K2GJL9U9GU04,POLICE CO-OPERATIVE SOCIETY LIMITED NO T 696,"27, 1279, 1, SOCIETY LTD T 696","nan, T.C.27/1279-1, POLICE CO-OPERATIVE, SOCIETY LTD T 696, NEAR AR CAMP,, NANDAVANAM, POLICE AR CAMP,, NANDAVANAM, VIKAS BHAVAN P O",THIRUVANANTHAPURAM,IN-KL,695033,IN
984500FETF89E1FFEB86,SHREEM INFRA,"26, 111, 1238, 001","nan, T.P. Scheme No. 26, Plot No. 111, Survey No. 1238/001, Vasna Hadmatiya-Uvarsad Vavol Road, Directorate Of Medicine Store, Uvarsad",Gandhinagar,IN-GJ,382016,IN
648806D2IV05ZRX0K434,AARAMBH INFRACON,"48, 176, 177, 2","Pasodara Road, T.P.48, F.P. 176/177, SUB PLOT NO. 2 AARAMBH HEIGHTS, NEAR SURBHI SOCIETY, Pasodra Patiya",Surat,,394185,IN
9845007BBF2CB73BD534,VEENUS ENGINEERING WORKS,"5443, 1, 1TH","nan, T.S. NO. 5443/1, OPP. TO KVB, MARTHANDAPURAM, 1TH STREET",Pudukkottai,IN-TN,622001,IN
984500DC4A6C6KF04442,BALDEV ENGINEERING,232,"nan, T.T.C INDUTRIAL AREA, BHATTI MOTORS, PLOT NO. D-, NEAR AUTOMOTIVE MARUTI SHOWROOM, MUMBAI-PUNE ROAD, Thane",NAVI MUMBAI,IN-MH,400706,IN
9845003B6A7DN9AAC663,WESTERN INFRABUILD PRODUCTS LLP,"Sector 2, 592","nan, T.T.C. Industrial Area, Sector 2, Pawne, Plot No. A-592, TTC Industrial Area, MIDC, Mahape",Mumbai,IN-MH,400705,IN
9845008B3F1L4FAF5224,MANSI MANUFACTURER AND SERVICES PRIVATE LIMITED,"Sector 2, 25","nan, T.T.C. Industrial Area, Sector 2, Pawne, Plot No. PAP-R-25, MIDC, Rabale",Thane,IN-MH,400701,IN
984500A2DCD53DE1M571,OSRAM VENTURES LLP,"Sector 2, 2302, 23RD, D33, D207","MIDC Road, T.T.C. Industrial Area, Sector 2, Pawne, UNIT NO. 2302, 23RD FLOOR, PLOT NO. D33/D207, TTC INDUSTRIAL AREA, NAVI MUMBAI",Thane,IN-MH,400705,IN
9845008R747C9C8AF610,JAGLAX HOSPITALITY LLP,T16 W NO 8,"nan, NEAR MASJID",New Delhi,IN-DL,110030,IN
8945006EYFZTLCI0ZA94,AADHITHYA MULTI TRADE LINKS,"TENRA 123, 24, 1767, 2, 77","nan, TENRA 123, Thycaud, TC.24/1767-2, TENRA-77, SIVAMANGALAM, ELANGAM NAGAR, THYCAUD.P.O",THIRUVANTHAPURAM,,695014,IN
984500448A8FCFC01344,MOTHER DREAMS RURAL & URBAN EDUCATION DEVELOPMENT SOCIETY (R)SC,1ST,"nan, THUREBAILU,  BLOCK, BHEEMASAMUDRA",Chitradurga,IN-KA,577520,IN
3358008E8P77Q8IORR42,GAURI INFRA.,"TP 13, 401","Guru Gobindsinhji Marg, TP 13, Chhani Jakatnaka, 401, RIDDHI SIDDHI ALNZA, BEHIND DOMINO PIZZA, SUBHANPURA, VADODARA, VADODARA, GUJARAT",VADODARA,IN-GJ,390023,IN
984500600BD79O7D9B86,SARTHA BUILDCOM,"82, 99","nan, TP-82, FP-99/B, Surat Dumas Road, The Weekend Address, Near Delhi Public School",Surat,IN-GJ,395007,IN
33580036OSQBB1RYZD48,GRANDIS PLY,"4, 370, 1, 2, 370, 1, 2, 3, 4","Anjalpetty - Myloor Road, TUFFO PLY INDUSTRIAL PARK UNIT-4, SY.NO., 370/1-2, 370/1-2-3, GRANDISPLY, TUFFO PLY INDUSTRIAL PARK, UNIT-4, ENANALLOOR P O, MYLTHADAM",MUVATTUPUZHA,IN-KL,686673,IN
984500BACFFC8D88F437,VISHVAM HEALTH CARE AND RESEARCH PRIVATE LIMITED,"27, 1","nan, Tagore Nagar, NAVKAR HOSPITAL, B-27, RING ROAD NO. 1, MLA REST HOUSE",RAIPUR,IN-CG,492001,IN
984500D1F3D507147193,PK INVESTMENTS,1,"nan, Tagore Nagar, Vikhroli, , Kartarpura",Jaipur,IN-RJ,302006,IN
3358008D3I84TXV4Y576,STRONG CONSTRUCTION,"224, 88","nan, Tagore Town, 224/88",PRAYAGRAJ,IN-UP,211002,IN
894500AK5N2R6B920M32,REAL G-TRANS EXPRESS PRIVATE LIMITED,117A,"nan, Taj Nagar, Sher Shah Suri Nagar, , Super Palace Colony, Khajrana, Kanadia",INDORE,,452016,IN
9845003CA2CBJ5CBBE78,PVN TRANSFORMERS & ELECTRICALS PRIVATE LIMITED,"243, 2, 1","243, Shiv Road, Takali, S. No. 243/2/1, Crusher, Pimplad, Nashik (M Corp.)",Nashik,IN-MH,422010,IN
9845004FQAE1EE2D5581,CONNECTION TECHNOLOGY SYSTEMS INDIA PRIVATE LIMITED,"1, 1st","Kanakapura Main Road, Talaghattapura, No.  Floor, RK Residency, Vajarahalli Uttarahall Talgatpura, Kanakpura Rd",Bangalore,IN-KA,560062,IN
89450038PIK5X5NLH216,PATEL PUNIT BUILDERS PVT LTD,JITENDRA COMPLEX SHOP NO 111,"Jayshree Road, Talav Gate, ST FLOOR KALWA CHOWK, JUNAGADH",JUNAGADH,,362001,IN
335800K3ZG2HMVD1AE58,WESTERN GEARS,"53, 451","nan, Talwade, GAT.NO.53/451, TALAWADE CHOWK, TALAWADE, TAL-HAVELI",PUNE,IN-MH,411062,IN
335800ESDMDMV1UULI11,CHAVIASHU COTTEX LLP,"14, 122","nan, Tambe Mala, 14/122 TAMBE MADAICHALKARANJI, KOLHAPUR, HATKANANGLE",ICHALKARANJI,IN-MH,416115,IN
984500CLBCB4FCF1EP29,PRABHU NAIDU LIMITED,"524, 14483, 12","Teen Batti Chowk, Tambe Mala, Common Conn Apartment, G No. 524, CS No. 14483/12, Surve Nagar, Ichalkaranji",Kolhapur,IN-MH,416115,IN
3358008MBQ233OZ2M219,TORRENT GREEN ENERGY PRIVATE LIMITED,SAMNVAY600,"nan, Tapovan, , AMBAWADI",AHMEDABAD,IN-GJ,380015,IN
8945002MOV1DMTGUWM13,SRI MAHESH PHARMA,"PLOT NO 2, 3","nan, Tar Bund, GROUND FLOOR, , Chitta Reddy Colony, TADBUND X ROAD, NEAR HANUMAN TEMPLE",secunderabad,,500009,IN
9845004A5B01C9E9B802,DATTATRAY CONSTRUCTION,460B,"nan, Tarapur, HOUSE NO. , GHIVALI, TARAPUR- BOISAR ROAD",PALGHAR,IN-MH,401502,IN
8945007H5467WQC39290,MOLTUS RESEARCH LABORATORIES PRIVATE LIMITED,59,"59, MIDC Road, Tarapur, N-, TARAPUR PALGHAR",TARAPUR,,401506,IN
335800U8XWL8DYBP6K27,DIAMAR DIAMONDS PRIVATE LIMITED,"15B, 10, 4TH","Sleater Road, Tardeo, 15B ARUNA NIWAS, FLAT NO. 10, 4TH FLOOR, MUMBAI",MUMBAI,IN-MH,400007,IN
984500E40716FADF3950,AMP FITNESS LLP,"58, Floor 6","62, Pedder Road, Tardeo, , Plot No., B Nalanda Building, Dr. Gopalrao Deshmukh Marg, Cumballa Hill",Mumbai,IN-MH,400026,IN
